{
  "baseline_value": "/tmp",
  "confirmations": 2,
  "dependency_key": "570c72ad322c39c7ec662498a120b8f9decc2ce1fa6f3e5f1f1550815900e391",
  "isolation": "workspace_copy",
  "kind": "environment",
  "mechanism": "environment_override",
  "operation": "getenv",
  "oracle_ref": "f4-trace:workloads/external/fd-build-completions/adapter/trace.tsv",
  "plan_id": "52d148dff5d6cee12658f01e365476216b1a378c7e194272dd7e432ca342020d",
  "resource": "TMPDIR",
  "resource_type": "environment_variable",
  "result_blind_selection": true,
  "schema_version": "f9.intervention_plan.v1",
  "source_run_id": "f9-8a-fd-build-completions",
  "treatment_value": "/var/tmp"
}
